{
  "schema_version": 1,
  "case_id": "rw-009-seneca",
  "review_status": "quarantined",
  "independent_evidence": {
    "incident_reference_urls": [
      "https://app.blocksec.com/explorer/tx/eth/0x23fcf9d4517f7cc39815b09b0a80c023ab2c8196c826c93b4100f2e26b701286",
      "https://twitter.com/Phalcon_xyz/status/1763045563040411876"
    ],
    "source_repository_url": "https://github.com/SunWeb3Sec/DeFiHackLabs",
    "source_repository_commit": "6af208c2f11a8e520af7b9a31916e5537127a601",
    "source_file_path": "src/test/2024-02/Seneca_exp.sol",
    "source_sha256": "eeb6a4a7c030ffb13d45b8182cc7bc0387cd2f893502a0bb76e974bffde5fac5",
    "onchain_transaction_urls": [
      "https://etherscan.io/tx/0x23fcf9d4517f7cc39815b09b0a80c023ab2c8196c826c93b4100f2e26b701286"
    ],
    "chain_and_block": "requires independent verification"
  },
  "root_cause": {
    "family": "access_control, unchecked_external_call, input_validation",
    "affected_contract": "0x65c210c59b43eb68112b7a4f75c8393c36491f06",
    "affected_functions": [
      "performOperations"
    ],
    "source_line_ranges": [],
    "mechanism_summary": "",
    "external_evidence_quotes_or_paraphrases": []
  },
  "reproduction": {
    "owned_fixture_path": null,
    "fork_block": null,
    "poc_source_provenance": "Third-party discovery PoC is not executed or copied automatically.",
    "execution_status": "not_started",
    "limitations": [
      "Pinned contract implementation source and line mapping are not yet stored in an owned fixture."
    ]
  },
  "detector_mapping": {
    "covered_by_existing_detector": false,
    "detector_names": [],
    "mapping_rationale": "No detector mapping is admitted before source-level review.",
    "not_covered_reason": "Pending independent source mapping and detector coverage review."
  },
  "review": {
    "ground_truth_decision": "quarantine",
    "decision_rationale": "Candidate is documented for discovery but excluded from all metrics until admission gates are complete.",
    "reviewer_independence": "separate_from_analyzer_and_llm",
    "reviewed_at": "",
    "admission_requirements_remaining": [
      "Pin the affected implementation source and exact version.",
      "Map the incident to source line ranges independently.",
      "Verify chain and block metadata from immutable on-chain evidence.",
      "Create and review an owned reproduction or document why reproduction is infeasible.",
      "Adjudicate detector coverage without using analyzer or LLM output as Ground Truth."
    ]
  }
}
