{
  "schema_version": 1,
  "case_id": "rw-004-bonqdao",
  "review_status": "quarantined",
  "independent_evidence": {
    "incident_reference_urls": [
      "https://polygonscan.com/address/0x8f55d884cad66b79e1a131f6bcb0e66f4fd84d5b#code#F2#L282",
      "https://medium.com/@omniscia.io/bonq-protocol-incident-post-mortem-4fd79fe5c932",
      "https://hacken.io/insights/bonqdao-hack/"
    ],
    "source_repository_url": "https://github.com/SunWeb3Sec/DeFiHackLabs",
    "source_repository_commit": "2baf1a43c44d6cb3ce17a678701784fbe7edabad",
    "source_file_path": "src/test/2023-02/BonqDAO_exp.sol",
    "source_sha256": "1b16549a68b78baa830af0c28dd922a1c0c2a9ff5d82556a93318ded825df30a",
    "onchain_transaction_urls": [
      "https://etherscan.io/tx/0x31957ecc43774d19f54d9968e95c69c882468b46860f921668f2c55fadd51b19",
      "https://etherscan.io/tx/0xa02d0c3d16d6ee0e0b6a42c3cc91997c2b40c87d777136dedebe8ee0f47f32b1"
    ],
    "chain_and_block": "requires independent verification"
  },
  "root_cause": {
    "family": "oracle, price_manipulation, accounting",
    "affected_contract": "0x8f55d884cad66b79e1a131f6bcb0e66f4fd84d5b",
    "affected_functions": [
      "updateValue",
      "borrow",
      "liquidate"
    ],
    "source_line_ranges": [],
    "mechanism_summary": "",
    "external_evidence_quotes_or_paraphrases": []
  },
  "reproduction": {
    "owned_fixture_path": null,
    "fork_block": null,
    "poc_source_provenance": "Third-party discovery PoC is not executed or copied automatically.",
    "execution_status": "not_started",
    "limitations": [
      "Pinned contract implementation source and line mapping are not yet stored in an owned fixture."
    ]
  },
  "detector_mapping": {
    "covered_by_existing_detector": false,
    "detector_names": [],
    "mapping_rationale": "No detector mapping is admitted before source-level review.",
    "not_covered_reason": "Pending independent source mapping and detector coverage review."
  },
  "review": {
    "ground_truth_decision": "quarantine",
    "decision_rationale": "Candidate is documented for discovery but excluded from all metrics until admission gates are complete.",
    "reviewer_independence": "separate_from_analyzer_and_llm",
    "reviewed_at": "",
    "admission_requirements_remaining": [
      "Pin the affected implementation source and exact version.",
      "Map the incident to source line ranges independently.",
      "Verify chain and block metadata from immutable on-chain evidence.",
      "Create and review an owned reproduction or document why reproduction is infeasible.",
      "Adjudicate detector coverage without using analyzer or LLM output as Ground Truth."
    ]
  }
}
