{
  "schema_version": 1,
  "case_id": "rw-007-conic-finance",
  "review_status": "quarantined",
  "independent_evidence": {
    "incident_reference_urls": [
      "https://medium.com/@ConicFinance/post-mortem-eth-and-crvusd-omnipool-exploits-c9c7fa213a3d",
      "https://etherscan.io/address/0xbb787d6243a8d450659e09ea6fd82f1c859691e9#code"
    ],
    "source_repository_url": "https://github.com/SunWeb3Sec/DeFiHackLabs",
    "source_repository_commit": "2baf1a43c44d6cb3ce17a678701784fbe7edabad",
    "source_file_path": "src/test/2023-07/Conic_exp.sol",
    "source_sha256": "8c6190ff8008f2fe222cc9ee6821ace439bc2fef1021f9d93dbd8b873cfca89e",
    "onchain_transaction_urls": [
      "https://etherscan.io/tx/0x8b74995d1d61d3d7547575649136b8765acb22882960f0636941c44ec7bbe146"
    ],
    "chain_and_block": "requires independent verification"
  },
  "root_cause": {
    "family": "read_only_reentrancy, oracle, price_manipulation",
    "affected_contract": "0xbb787d6243a8d450659e09ea6fd82f1c859691e9",
    "affected_functions": [
      "getUSDPrice",
      "deposit",
      "withdraw",
      "handleDepeggedCurvePool"
    ],
    "source_line_ranges": [],
    "mechanism_summary": "",
    "external_evidence_quotes_or_paraphrases": []
  },
  "reproduction": {
    "owned_fixture_path": null,
    "fork_block": null,
    "poc_source_provenance": "Third-party discovery PoC is not executed or copied automatically.",
    "execution_status": "not_started",
    "limitations": [
      "Pinned contract implementation source and line mapping are not yet stored in an owned fixture."
    ]
  },
  "detector_mapping": {
    "covered_by_existing_detector": false,
    "detector_names": [],
    "mapping_rationale": "No detector mapping is admitted before source-level review.",
    "not_covered_reason": "Pending independent source mapping and detector coverage review."
  },
  "review": {
    "ground_truth_decision": "quarantine",
    "decision_rationale": "Candidate is documented for discovery but excluded from all metrics until admission gates are complete.",
    "reviewer_independence": "separate_from_analyzer_and_llm",
    "reviewed_at": "",
    "admission_requirements_remaining": [
      "Pin the affected implementation source and exact version.",
      "Map the incident to source line ranges independently.",
      "Verify chain and block metadata from immutable on-chain evidence.",
      "Create and review an owned reproduction or document why reproduction is infeasible.",
      "Adjudicate detector coverage without using analyzer or LLM output as Ground Truth."
    ]
  }
}
